{
  "schemaVersion": 1,
  "revision": 2,
  "status": "pending",
  "approval": null,
  "feature": {
    "key": "fnm-portfolio-health-check-service-dev",
    "name": "fnm-portfolio-health-check-service-dev",
    "owner": "Kane (to confirm)",
    "goal": "Portfolio Health Check management for relationship managers: a Miller-column workspace that drills from a customer dashboard into portfolio summaries, versions and holdings, generates a password-protected PDF health-check report and books customer appointments.",
    "scope": [
      "Dashboard with customer search and filters",
      "Customer drilldown, portfolio summary, versions and version detail columns",
      "Portfolio management: asset list, allocation check, report generation with PDF password",
      "Set-password modal",
      "Appointment modal",
      "Add-asset modal"
    ],
    "nonGoals": [
      "Authentication",
      "Real portfolio data or pricing APIs (mock data stands in)",
      "Report rendering itself"
    ]
  },
  "source": {
    "input": "prototype",
    "kind": "react-vite",
    "prototype": {
      "files": {
        "index.html": "sha256:20d46d446c62d5fd00a92f8be1675483a580a7e0bbdc8a012eae94ff6323b5e7",
        "src/App.jsx": "sha256:d4228d350fc7992a881b3088fcce053fcdc98f2668858818f44ace645d370d0a",
        "src/components/Dashboard/Dashboard.jsx": "sha256:f2107df77026ab2f1189c78abd5654475e71596c835e15ecaa13a777b356f616",
        "src/components/Modals/AppointmentModal.jsx": "sha256:6d68a002baed9076771627f682d6bf1a5761b625a5c3dc8937a797551803202d",
        "src/components/Modals/SetPasswordModal.jsx": "sha256:2e8475e3fc523ee0f3c1295ed4916f19b3987f23c8d3cc180b62292972aaad1a",
        "src/components/PortfolioManagement/PortfolioManagement.jsx": "sha256:e0ac8237b66d099d11590a6319288de9f4d8b06ddb40d5d0c53f6c91bad020f6",
        "src/components/PortfolioSummary/PortfolioSummary.jsx": "sha256:82f72df90ae4b3bc1d6b4b426cde16726bd896bff70da26e7e8fe90e086866ba",
        "src/components/PortfolioVersion/PortfolioVersion.jsx": "sha256:dd6467d941990aa82196166da9b3e847ba096481da6ce232eaea0b0fb8e7d7a8",
        "src/components/PortfolioVersionDetail/PortfolioVersionDetail.jsx": "sha256:23680b177aa218d36f2f30d65eab78228fc924b5df8680205c3cbc930f73f79b",
        "src/data/mockData.js": "sha256:292baf5614cb46e4cba272a0cb582b0cda0ba92066c25c3e9176111fe0fb3426",
        "src/main.jsx": "sha256:f8ef68b65f8d31c03f05da0d813076c7e38e511cce642e2f21d4f05ef3ea6207"
      },
      "snapshotId": "sha256:3baf998c522cc787c632b296d9bfc22109c5ce5ea525d05e984c926f0a679ac1"
    },
    "designSystem": "carbon",
    "contracts": {
      "button": {
        "snapshotId": "sha256:4c82c3cc7f2af6fa24fba39bb5e159c415b5691800130268c9d8903901164152",
        "contentHash": "sha256:4a9e9f38d7a42ccfd0ea029241862365784bfe49b7f087e48ceee8ee07711bf5"
      },
      "text-input": {
        "snapshotId": "sha256:1a5e61e829858c59e445d7febf9c44c5d920bae55ddd39de50851196f1502c4c",
        "contentHash": "sha256:ffc567ffda43ccc993b609efd9111bb3d652edadddf331cf0bd9f77b67e8e151"
      }
    },
    "proposals": {},
    "foundations": {
      "documentHash": "sha256:9f99c2066cc22e492d01bfc15814cdbd9ea347e47f4a6eb752d17b909315fb45",
      "usedHash": "sha256:8348c90c709ee2967ae13ed2fdcf31b90ec1f28bbaf05ce217531772c6b624ac"
    },
    "modes": {
      "light": "g10"
    },
    "notes": [
      {
        "level": "info",
        "text": "`<Theme theme=\"g10\">` (src/App.jsx:739:5) sets the Prototype's mode to Gray 10; the page surfaces are not compared. The other Theme modes render unverified."
      },
      {
        "level": "info",
        "text": "Region `theme`: `Theme` (@carbon/react, src/App.jsx:739:5) holds other Code Library usages, so it is read as a wrapper: its parts' styles and text stay in the region, and the usages inside it are their own."
      },
      {
        "level": "info",
        "text": "Region `theme`: `Modal` (@carbon/react, src/App.jsx:817:7) holds other Code Library usages, so it is read as a wrapper: its parts' styles and text stay in the region, and the usages inside it are their own."
      },
      {
        "level": "info",
        "text": "Region `theme`: `Modal` (@carbon/react, src/components/Modals/SetPasswordModal.jsx:26:5) holds other Code Library usages, so it is read as a wrapper: its parts' styles and text stay in the region, and the usages inside it are their own."
      },
      {
        "level": "info",
        "text": "Region `theme`: `Modal` (@carbon/react, src/components/Modals/AppointmentModal.jsx:50:5) holds other Code Library usages, so it is read as a wrapper: its parts' styles and text stay in the region, and the usages inside it are their own."
      }
    ]
  },
  "screens": [
    {
      "id": "index",
      "name": "/",
      "at": "src/main.jsx:7:3",
      "breakpoints": [
        "sm",
        "md",
        "lg",
        "xlg",
        "max"
      ],
      "regions": [
        {
          "id": "shell",
          "landmark": null,
          "shell": true,
          "at": "index.html:2:1",
          "styles": [],
          "text": [],
          "usages": []
        },
        {
          "id": "theme",
          "landmark": null,
          "at": "src/App.jsx:739:5",
          "styles": [],
          "text": [
            {
              "copy": "phc-column-title",
              "at": "src/App.jsx:161:47",
              "style": {
                "raw": {
                  "fontSize": 17,
                  "lineHeight": 24,
                  "fontWeight": 500,
                  "letterSpacing": 0
                }
              }
            },
            {
              "copy": "phc-kpi-tile-value",
              "at": "src/components/Dashboard/Dashboard.jsx:74:51",
              "style": {
                "partial": {
                  "fontSize": {
                    "token": "heading-05-font-size",
                    "candidates": [
                      "fluid-heading-05-font-size",
                      "fluid-heading-06-font-size",
                      "fluid-quotation-02-font-size",
                      "heading-05-font-size"
                    ],
                    "by": "agent"
                  }
                },
                "raw": {
                  "fontSize": 32,
                  "lineHeight": 32,
                  "fontWeight": 600,
                  "letterSpacing": 0
                }
              }
            },
            {
              "copy": "phc-kpi-tile-label",
              "at": "src/components/Dashboard/Dashboard.jsx:76:53",
              "style": {
                "raw": {
                  "fontSize": 11.2,
                  "lineHeight": 11.2,
                  "fontWeight": 500,
                  "letterSpacing": 0.64
                }
              }
            },
            {
              "copy": "span",
              "at": "src/components/Dashboard/Dashboard.jsx:92:22",
              "style": {
                "partial": {
                  "fontSize": {
                    "token": "body-compact-02-font-size",
                    "candidates": [
                      "body-02-font-size",
                      "body-compact-02-font-size",
                      "expressive-heading-02-font-size",
                      "heading-02-font-size",
                      "heading-compact-02-font-size"
                    ],
                    "by": "agent"
                  }
                },
                "raw": {
                  "fontSize": 16,
                  "lineHeight": 16,
                  "fontWeight": 600,
                  "letterSpacing": -0.16
                }
              }
            },
            {
              "copy": "span-2",
              "at": "src/components/Dashboard/Dashboard.jsx:94:24",
              "style": {
                "raw": {
                  "fontSize": 15.2,
                  "lineHeight": 15.2,
                  "fontWeight": 600,
                  "letterSpacing": -0.16
                }
              }
            },
            {
              "copy": "h3",
              "at": "src/components/PortfolioManagement/PortfolioManagement.jsx:115:12",
              "states": [],
              "style": {
                "partial": {
                  "fontSize": {
                    "token": "body-compact-02-font-size",
                    "candidates": [
                      "body-02-font-size",
                      "body-compact-02-font-size",
                      "expressive-heading-02-font-size",
                      "heading-02-font-size",
                      "heading-compact-02-font-size"
                    ],
                    "by": "agent"
                  }
                },
                "raw": {
                  "fontSize": 16,
                  "lineHeight": null,
                  "fontWeight": 700,
                  "letterSpacing": 0
                }
              }
            },
            {
              "copy": "span-3",
              "at": "src/components/PortfolioManagement/PortfolioManagement.jsx:118:11",
              "states": [],
              "style": {
                "partial": {
                  "fontSize": {
                    "token": "body-compact-02-font-size",
                    "candidates": [
                      "body-02-font-size",
                      "body-compact-02-font-size",
                      "expressive-heading-02-font-size",
                      "heading-02-font-size",
                      "heading-compact-02-font-size"
                    ],
                    "by": "agent"
                  }
                },
                "raw": {
                  "fontSize": 16,
                  "lineHeight": null,
                  "fontWeight": 400,
                  "letterSpacing": 0
                }
              }
            },
            {
              "copy": "h4",
              "at": "src/components/PortfolioManagement/PortfolioManagement.jsx:125:57",